<?xml version="1.0" encoding="UTF-8" standalone="no"?>
<buses xmlns="http://www.example.com/buses"
         xmlns:xsi="http://www.w3.org/2001/XMLSchema-instance"
         xsi:schemaLocation="http://www.example.com/buses BusesXsd.xsd">
    <bus>
        <id>1</id>
        <capacity>5</capacity>
    </bus>
    <bus>
        <id>2</id>
        <capacity>4</capacity>
    </bus>
    <bus>
        <id>3</id>
        <capacity>3</capacity>
    </bus>

</buses>